{
  "actionItems": [
    {
      "actionId": "review_scientific_ledger.row_level_lod_coverage",
      "blocking": false,
      "category": "scientific_ledger_data_gap",
      "decisionStatus": "pending",
      "dueState": "current_cycle",
      "escalated": false,
      "escalationType": null,
      "followUpNote": null,
      "linkedRecordIds": [
        "row_level_lod_coverage",
        "eu.mercury.analytical_method_evidence.official_control"
      ],
      "ownerLane": "scientific_reviewer",
      "priority": "review_required",
      "queueLabels": [
        "open",
        "pending"
      ],
      "rationale": null,
      "summary": "Row-level LOD coverage is incomplete. Keep the governed scientific ledger rationale explicit in reviewer signoff.",
      "supportingUris": [],
      "title": "Review analytical measurement ledger entry",
      "triageRank": 1
    },
    {
      "actionId": "review_scientific_ledger.lower_bound_handling.eu.mercury.occurrence_evidence.official_monitoring_context",
      "blocking": false,
      "category": "scientific_ledger_assumption",
      "decisionStatus": "pending",
      "dueState": "current_cycle",
      "escalated": false,
      "escalationType": null,
      "followUpNote": null,
      "linkedRecordIds": [
        "lower_bound_handling.eu.mercury.occurrence_evidence.official_monitoring_context",
        "eu.mercury.occurrence_evidence.official_monitoring_context"
      ],
      "ownerLane": "scientific_reviewer",
      "priority": "review_required",
      "queueLabels": [
        "open",
        "pending"
      ],
      "rationale": null,
      "summary": "Lower-bound handling is governed by linked occurrence evidence. Keep the governed scientific ledger rationale explicit in reviewer signoff.",
      "supportingUris": [],
      "title": "Review occurrence data ledger entry",
      "triageRank": 2
    },
    {
      "actionId": "review_scientific_ledger.storage_stability.eu.mercury.analytical_method_evidence.official_control",
      "blocking": false,
      "category": "scientific_ledger_uncertainty",
      "decisionStatus": "pending",
      "dueState": "current_cycle",
      "escalated": false,
      "escalationType": null,
      "followUpNote": null,
      "linkedRecordIds": [
        "storage_stability.eu.mercury.analytical_method_evidence.official_control",
        "eu.mercury.analytical_method_evidence.official_control"
      ],
      "ownerLane": "scientific_reviewer",
      "priority": "review_required",
      "queueLabels": [
        "open",
        "pending"
      ],
      "rationale": null,
      "summary": "Storage-stability interpretation relies on governed analytical-method context. Keep the governed scientific ledger rationale explicit in reviewer signoff.",
      "supportingUris": [],
      "title": "Review analytical method ledger entry",
      "triageRank": 3
    },
    {
      "actionId": "review_scientific_ledger.sampling_plan.eu.mercury.analytical_method_evidence.official_control",
      "blocking": false,
      "category": "scientific_ledger_assumption",
      "decisionStatus": "pending",
      "dueState": "current_cycle",
      "escalated": false,
      "escalationType": null,
      "followUpNote": null,
      "linkedRecordIds": [
        "sampling_plan.eu.mercury.analytical_method_evidence.official_control",
        "eu.mercury.analytical_method_evidence.official_control"
      ],
      "ownerLane": "scientific_reviewer",
      "priority": "review_required",
      "queueLabels": [
        "open",
        "pending"
      ],
      "rationale": null,
      "summary": "Sampling-plan interpretation relies on governed analytical-method context. Keep the governed scientific ledger rationale explicit in reviewer signoff.",
      "supportingUris": [],
      "title": "Review sampling context ledger entry",
      "triageRank": 4
    }
  ],
  "board_id": "scientific-follow-up-board-865a4a91f5e0",
  "bundleProfile": "internal_review",
  "closedActionIds": [],
  "currentCycleActionIds": [
    "review_scientific_ledger.row_level_lod_coverage",
    "review_scientific_ledger.lower_bound_handling.eu.mercury.occurrence_evidence.official_monitoring_context",
    "review_scientific_ledger.storage_stability.eu.mercury.analytical_method_evidence.official_control",
    "review_scientific_ledger.sampling_plan.eu.mercury.analytical_method_evidence.official_control"
  ],
  "documentationResourceUri": "docs://scientific-follow-up-review-board",
  "dueStateGroups": [
    {
      "actionCount": 4,
      "actionIds": [
        "review_scientific_ledger.row_level_lod_coverage",
        "review_scientific_ledger.lower_bound_handling.eu.mercury.occurrence_evidence.official_monitoring_context",
        "review_scientific_ledger.storage_stability.eu.mercury.analytical_method_evidence.official_control",
        "review_scientific_ledger.sampling_plan.eu.mercury.analytical_method_evidence.official_control"
      ],
      "blockingActionIds": [],
      "dueState": "current_cycle",
      "ownerLanes": [
        "scientific_reviewer"
      ]
    }
  ],
  "immediateActionIds": [],
  "inProgressActionIds": [],
  "legalLimitReviews": [
    {
      "authority": null,
      "commodityCode": null,
      "contaminantFamily": "mercury_food_contaminants",
      "coverageSummaries": [],
      "curatedScopeCommodityCodes": [],
      "curatedScopeMatrixGroups": [],
      "jurisdiction": "eu",
      "legalAuthorities": [],
      "matchedRecords": [],
      "matrixGroup": "broad_food_supply",
      "notes": [
        "No governed contaminant legal-limit records matched the requested filters.",
        "Jurisdiction-specific contaminant legal-limit gaps are surfaced explicitly instead of borrowing values from another authority or matrix."
      ],
      "overallSubmissionUse": "review_required",
      "qualityFlags": [
        {
          "code": "coverage_gap",
          "message": "No governed contaminant legal-limit coverage is currently curated for family `mercury_food_contaminants` in jurisdiction `eu`.",
          "severity": "warning"
        },
        {
          "code": "no_jurisdiction_specific_legal_limit",
          "message": "No jurisdiction-specific contaminant legal limit matched the requested lane for `eu`.",
          "severity": "warning"
        },
        {
          "code": "no_curated_legal_limit_for_requested_lane",
          "message": "No curated contaminant legal-limit record matched matrix `broad_food_supply` in `eu`.",
          "severity": "warning"
        }
      ],
      "requestedLaneStatus": "no_curated_family_coverage",
      "substanceKey": null
    },
    {
      "authority": null,
      "commodityCode": null,
      "contaminantFamily": "mercury_food_contaminants",
      "coverageSummaries": [],
      "curatedScopeCommodityCodes": [],
      "curatedScopeMatrixGroups": [],
      "jurisdiction": "eu",
      "legalAuthorities": [],
      "matchedRecords": [],
      "matrixGroup": "fish_and_seafood",
      "notes": [
        "No governed contaminant legal-limit records matched the requested filters.",
        "Jurisdiction-specific contaminant legal-limit gaps are surfaced explicitly instead of borrowing values from another authority or matrix."
      ],
      "overallSubmissionUse": "review_required",
      "qualityFlags": [
        {
          "code": "coverage_gap",
          "message": "No governed contaminant legal-limit coverage is currently curated for family `mercury_food_contaminants` in jurisdiction `eu`.",
          "severity": "warning"
        },
        {
          "code": "no_jurisdiction_specific_legal_limit",
          "message": "No jurisdiction-specific contaminant legal limit matched the requested lane for `eu`.",
          "severity": "warning"
        },
        {
          "code": "no_curated_legal_limit_for_requested_lane",
          "message": "No curated contaminant legal-limit record matched matrix `fish_and_seafood` in `eu`.",
          "severity": "warning"
        }
      ],
      "requestedLaneStatus": "no_curated_family_coverage",
      "substanceKey": null
    },
    {
      "authority": null,
      "commodityCode": null,
      "contaminantFamily": "mercury_food_contaminants",
      "coverageSummaries": [],
      "curatedScopeCommodityCodes": [],
      "curatedScopeMatrixGroups": [],
      "jurisdiction": "eu",
      "legalAuthorities": [],
      "matchedRecords": [],
      "matrixGroup": "large_predatory_fish",
      "notes": [
        "No governed contaminant legal-limit records matched the requested filters.",
        "Jurisdiction-specific contaminant legal-limit gaps are surfaced explicitly instead of borrowing values from another authority or matrix."
      ],
      "overallSubmissionUse": "review_required",
      "qualityFlags": [
        {
          "code": "coverage_gap",
          "message": "No governed contaminant legal-limit coverage is currently curated for family `mercury_food_contaminants` in jurisdiction `eu`.",
          "severity": "warning"
        },
        {
          "code": "no_jurisdiction_specific_legal_limit",
          "message": "No jurisdiction-specific contaminant legal limit matched the requested lane for `eu`.",
          "severity": "warning"
        },
        {
          "code": "no_curated_legal_limit_for_requested_lane",
          "message": "No curated contaminant legal-limit record matched matrix `large_predatory_fish` in `eu`.",
          "severity": "warning"
        }
      ],
      "requestedLaneStatus": "no_curated_family_coverage",
      "substanceKey": null
    }
  ],
  "notes": [
    "Scientific follow-up review board is derived from the queue bundle and does not mutate readiness, signoff, or dossier state.",
    "Owner lanes and due states are deterministic routing metadata for reviewer operations, not new regulatory rules.",